A1: ID | B1: 1 | C1: 2 | D1: 3 | E1: 4 | F1: 5 | G1: 6 | H1: 7 | I1: 8 | J1: Total
A2: 5740825 | B2: 5 | C2: 4 | D2: 4 | E2: 5 | F2: 5 | G2: 6 | H2: 6 | I2: 5 | J2: =SUM(B2:I2) -> 40
A3: 5743229 | B3: 5 | C3: 4 | D3: 4 | E3: 5 | F3: 4.8 | G3: 6 | H3: 6 | I3: 5 | J3: =SUM(B3:I3) -> 39.8
A4: 6666856 | B4: 5 | C4: 3.6 | D4: 4 | E4: 5 | F4: 5 | G4: 6 | H4: 6 | I4: 5 | J4: =SUM(B4:I4) -> 39.6
A5: 6708147 | B5: 5 | C5: 3.6 | D5: 4 | E5: 5 | F5: 5 | G5: 6 | H5: 5.9 | I5: 5 | J5: =SUM(B5:I5) -> 39.5
A6: 5737737 | B6: 5 | C6: 4 | D6: 4 | E6: 5 | F6: 4.7 | G6: 6 | H6: 5.5 | I6: 5 | J6: =SUM(B6:I6) -> 39.2
A7: 5735428 | B7: 5 | C7: 3.6 | D7: 4 | E7: 4.8 | F7: 4.7 | G7: 6 | H7: 6 | I7: 5 | J7: =SUM(B7:I7) -> 39.1
A8: 5734371 | B8: 4.5 | C8: 3.6 | D8: 4 | E8: 4.9 | F8: 5 | G8: 6 | H8: 6 | I8: 5 | J8: =SUM(B8:I8) -> 39
A9: 6197829 | B9: 5 | C9: 4 | D9: 4 | E9: 5 | F9: 5 | G9: 6 | H9: 5 | I9: 5 | J9: =SUM(B9:I9) -> 39
A10: 6603842 | B10: 5 | C10: 4 | D10: 4 | E10: 5 | F10: 4.9 | G10: 6 | H10: 5 | I10: 5 | J10: =SUM(B10:I10) -> 38.9
A11: 6019613 | B11: 5 | C11: 3.6 | D11: 4 | E11: 5 | F11: 4.2 | G11: 6 | H11: 6 | I11: 5 | J11: =SUM(B11:I11) -> 38.8
A12: 6691746 | B12: 5 | C12: 3.6 | D12: 4 | E12: 5 | F12: 4.7 | G12: 6 | H12: 5.5 | I12: 5 | J12: =SUM(B12:I12) -> 38.8
A13: 6660307 | B13: 4 | C13: 4 | D13: 4 | E13: 5 | F13: 4.5 | G13: 5.5 | H13: 5.9 | I13: 4.9 | J13: =SUM(B13:I13) -> 37.8
A14: 5005419 | B14: 4.5 | C14: 4 | D14: 4 | E14: 5 | F14: 5 | G14: 5 | H14: 5 | I14: 5 | J14: =SUM(B14:I14) -> 37.5
A15: 5735894 | B15: 5 | C15: 3.3 | D15: 3.5 | E15: 5 | F15: 3.7 | G15: 6 | H15: 6 | I15: 5 | J15: =SUM(B15:I15) -> 37.5
A16: 6266424 | B16: 5 | C16: 3.6 | D16: 3.5 | E16: 5 | F16: 4.5 | G16: 6 | H16: 4.9 | I16: 5 | J16: =SUM(B16:I16) -> 37.5
A17: 6697269 | B17: 4 | C17: 3.6 | D17: 4 | E17: 5 | F17: 3.9 | G17: 6 | H17: 6 | I17: 5 | J17: =SUM(B17:I17) -> 37.5
A18: 6660254 | B18: 5 | C18: 3.6 | D18: 4 | E18: 4.8 | F18: 5 | G18: 6 | H18: 5 | I18: 4 | J18: =SUM(B18:I18) -> 37.4
A19: 5712000 | B19: 4 | C19: 4 | D19: 4 | E19: 5 | F19: 3 | G19: 5.9 | H19: 5.8 | I19: 5 | J19: =SUM(B19:I19) -> 36.7
A20: 6027830 | B20: 4.5 | C20: 4 | D20: 4 | E20: 4.9 | F20: 2.5 | G20: 6 | H20: 4.5 | I20: 5 | J20: =SUM(B20:I20) -> 35.4
A21: 6182446 | B21: 4 | C21: 4 | D21: 4 | E21: 5 | F21: 2 | G21: 6 | H21: 5 | I21: 5 | J21: =SUM(B21:I21) -> 35
A22: 6667977 | B22: 3.5 | C22: 4 | D22: 4 | E22: 5 | F22: 3.7 | G22: 5.5 | H22: 4 | I22: 5 | J22: =SUM(B22:I22) -> 34.7
A23: 6011568 | B23: 5 | C23: 3.6 | D23: 4 | E23: 5 | F23: 4 | G23: 4.5 | H23: 3.5 | I23: 4 | J23: =SUM(B23:I23) -> 33.6
A24: 6666765 | B24: 5 | C24: 4 | D24: 4 | E24: 5 | F24: 3 | G24: 6 | H24: 1 | I24: 5 | J24: =SUM(B24:I24) -> 33
A25: 6668531 | B25: 3.5 | C25: 3.6 | D25: 4 | E25: 5 | F25: 1 | G25: 6 | H25: 4.5 | I25: 5 | J25: =SUM(B25:I25) -> 32.6
A26: 6004254 | B26: 2.5 | C26: 2.9 | D26: 4 | E26: 5 | F26: 4.2 | G26: 6 | H26: 2.5 | I26: 5 | J26: =SUM(B26:I26) -> 32.1
A27: 6080650 | B27: 3 | C27: 3.6 | D27: 3.5 | E27: 4.5 | F27: 2.5 | G27: 6 | H27: 3.5 | I27: 5 | J27: =SUM(B27:I27) -> 31.6
A28: 6182513 | B28: 4 | C28: 3.6 | D28: 1.4 | E28: 4.8 | F28: 1.5 | G28: 6 | H28: 5 | I28: 5 | J28: =SUM(B28:I28) -> 31.3
A29: 6018580 | B29: 3.5 | C29: 3.8 | D29: 3.5 | E29: 5 | F29: 2 | G29: 6 | H29: 2 | I29: 5 | J29: =SUM(B29:I29) -> 30.8
A30: 5727627 | B30: 3 | C30: 3.5 | D30: 4 | E30: 5 | F30: 1 | G30: 6 | H30: 4 | I30: 4 | J30: =SUM(B30:I30) -> 30.5
A31: 5717270 | B31: 4.5 | C31: 4 | D31: 4 | E31: 0 | F31: 0 | G31: 4 | H31: 6 | I31: 5 | J31: =SUM(B31:I31) -> 27.5
A32: 6041446 | B32: 4.5 | C32: 3.5 | D32: 0.5 | E32: 0 | F32: 2 | G32: 5.5 | H32: 3 | I32: 5 | J32: =SUM(B32:I32) -> 24
A33: 6033190 | B33: 4 | C33: 3.6 | D33: 3.5 | E33: 4.5 | F33: 0.2 | G33: 3 | H33: 2 | I33: 3 | J33: =SUM(B33:I33) -> 23.8
A34: 4730718 | B34: 0 | C34: 0 | D34: 0 | E34: 0 | F34: 0 | G34: 0 | H34: 0 | I34: 0 | J34: 0
I35: AVG | J35: =AVERAGE(J2:J34) -> 34.227272727272727
I36: SD | J36: =STDEV(J2:J34) -> 7.5684077225361985