A1: ID | B1: 1 | C1: 2 | D1: 3 | E1: 4 | F1: 5 | G1: 6 | H1: 7 | I1: 8 | J1: Total
A2: 4730718 | B2: 0 | C2: 0 | D2: 0 | E2: 0 | F2: 0 | G2: 0 | H2: 0 | I2: 0 | J2: 0
A3: 5005419 | B3: 4.5 | C3: 4 | D3: 4 | E3: 5 | F3: 5 | G3: 5 | H3: 5 | I3: 5 | J3: =SUM(B3:I3) -> 37.5
A4: 5712000 | B4: 4 | C4: 4 | D4: 4 | E4: 5 | F4: 3 | G4: 5.9 | H4: 5.8 | I4: 5 | J4: =SUM(B4:I4) -> 36.7
A5: 5717270 | B5: 4.5 | C5: 4 | D5: 4 | E5: 0 | F5: 0 | G5: 4 | H5: 6 | I5: 5 | J5: =SUM(B5:I5) -> 27.5
A6: 5727627 | B6: 3 | C6: 3.5 | D6: 4 | E6: 5 | F6: 1 | G6: 6 | H6: 4 | I6: 4 | J6: =SUM(B6:I6) -> 30.5
A7: 5734371 | B7: 4.5 | C7: 3.6 | D7: 4 | E7: 4.9 | F7: 5 | G7: 6 | H7: 6 | I7: 5 | J7: =SUM(B7:I7) -> 39
A8: 5735428 | B8: 5 | C8: 3.6 | D8: 4 | E8: 4.8 | F8: 4.7 | G8: 6 | H8: 6 | I8: 5 | J8: =SUM(B8:I8) -> 39.1
A9: 5735894 | B9: 5 | C9: 3.3 | D9: 3.5 | E9: 5 | F9: 3.7 | G9: 6 | H9: 6 | I9: 5 | J9: =SUM(B9:I9) -> 37.5
A10: 5737737 | B10: 5 | C10: 4 | D10: 4 | E10: 5 | F10: 4.7 | G10: 6 | H10: 5.5 | I10: 5 | J10: =SUM(B10:I10) -> 39.2
A11: 5740825 | B11: 5 | C11: 4 | D11: 4 | E11: 5 | F11: 5 | G11: 6 | H11: 6 | I11: 5 | J11: =SUM(B11:I11) -> 40
A12: 5743229 | B12: 5 | C12: 4 | D12: 4 | E12: 5 | F12: 4.8 | G12: 6 | H12: 6 | I12: 5 | J12: =SUM(B12:I12) -> 39.8
A13: 6004254 | B13: 2.5 | C13: 2.9 | D13: 4 | E13: 5 | F13: 4.2 | G13: 6 | H13: 2.5 | I13: 5 | J13: =SUM(B13:I13) -> 32.1
A14: 6011568 | B14: 5 | C14: 3.6 | D14: 4 | E14: 5 | F14: 4 | G14: 4.5 | H14: 3.5 | I14: 4 | J14: =SUM(B14:I14) -> 33.6
A15: 6018580 | B15: 3.5 | C15: 3.8 | D15: 3.5 | E15: 5 | F15: 2 | G15: 6 | H15: 2 | I15: 5 | J15: =SUM(B15:I15) -> 30.8
A16: 6019613 | B16: 5 | C16: 3.6 | D16: 4 | E16: 5 | F16: 4.2 | G16: 6 | H16: 6 | I16: 5 | J16: =SUM(B16:I16) -> 38.8
A17: 6027830 | B17: 4.5 | C17: 4 | D17: 4 | E17: 4.9 | F17: 2.5 | G17: 6 | H17: 4.5 | I17: 5 | J17: =SUM(B17:I17) -> 35.4
A18: 6033190 | B18: 4 | C18: 3.6 | D18: 3.5 | E18: 4.5 | F18: 0.2 | G18: 3 | H18: 2 | I18: 3 | J18: =SUM(B18:I18) -> 23.8
A19: 6041446 | B19: 4.5 | C19: 3.5 | D19: 0.5 | E19: 0 | F19: 2 | G19: 5.5 | H19: 3 | I19: 5 | J19: =SUM(B19:I19) -> 24
A20: 6080650 | B20: 3 | C20: 3.6 | D20: 3.5 | E20: 4.5 | F20: 2.5 | G20: 6 | H20: 3.5 | I20: 5 | J20: =SUM(B20:I20) -> 31.6
A21: 6182446 | B21: 4 | C21: 4 | D21: 4 | E21: 5 | F21: 2 | G21: 6 | H21: 5 | I21: 5 | J21: =SUM(B21:I21) -> 35
A22: 6182513 | B22: 4 | C22: 3.6 | D22: 1.4 | E22: 4.8 | F22: 1.5 | G22: 6 | H22: 5 | I22: 5 | J22: =SUM(B22:I22) -> 31.3
A23: 6197829 | B23: 5 | C23: 4 | D23: 4 | E23: 5 | F23: 5 | G23: 6 | H23: 5 | I23: 5 | J23: =SUM(B23:I23) -> 39
A24: 6266424 | B24: 5 | C24: 3.6 | D24: 3.5 | E24: 5 | F24: 4.5 | G24: 6 | H24: 4.9 | I24: 5 | J24: =SUM(B24:I24) -> 37.5
A25: 6603842 | B25: 5 | C25: 4 | D25: 4 | E25: 5 | F25: 4.9 | G25: 6 | H25: 5 | I25: 5 | J25: =SUM(B25:I25) -> 38.9
A26: 6660254 | B26: 5 | C26: 3.6 | D26: 4 | E26: 4.8 | F26: 5 | G26: 6 | H26: 5 | I26: 4 | J26: =SUM(B26:I26) -> 37.4
A27: 6660307 | B27: 4 | C27: 4 | D27: 4 | E27: 5 | F27: 4.5 | G27: 5.5 | H27: 5.9 | I27: 4.9 | J27: =SUM(B27:I27) -> 37.8
A28: 6666765 | B28: 5 | C28: 4 | D28: 4 | E28: 5 | F28: 3 | G28: 6 | H28: 1 | I28: 5 | J28: =SUM(B28:I28) -> 33
A29: 6666856 | B29: 5 | C29: 3.6 | D29: 4 | E29: 5 | F29: 5 | G29: 6 | H29: 6 | I29: 5 | J29: =SUM(B29:I29) -> 39.6
A30: 6667977 | B30: 3.5 | C30: 4 | D30: 4 | E30: 5 | F30: 3.7 | G30: 5.5 | H30: 4 | I30: 5 | J30: =SUM(B30:I30) -> 34.7
A31: 6668531 | B31: 3.5 | C31: 3.6 | D31: 4 | E31: 5 | F31: 1 | G31: 6 | H31: 4.5 | I31: 5 | J31: =SUM(B31:I31) -> 32.6
A32: 6691746 | B32: 5 | C32: 3.6 | D32: 4 | E32: 5 | F32: 4.7 | G32: 6 | H32: 5.5 | I32: 5 | J32: =SUM(B32:I32) -> 38.8
A33: 6697269 | B33: 4 | C33: 3.6 | D33: 4 | E33: 5 | F33: 3.9 | G33: 6 | H33: 6 | I33: 5 | J33: =SUM(B33:I33) -> 37.5
A34: 6708147 | B34: 5 | C34: 3.6 | D34: 4 | E34: 5 | F34: 5 | G34: 6 | H34: 5.9 | I34: 5 | J34: =SUM(B34:I34) -> 39.5
I35: AVG | J35: =AVERAGE(J2:J34) -> 34.227272727272727
I36: SD | J36: =STDEV(J2:J34) -> 7.5684077225361834